{
  "schema": "ai-peer-review.response/v1",
  "review_id": "review-03ff5087c2d09fdb34d6bf44fdb2928a",
  "role": "reviewer",
  "turn": 2,
  "commit_mode": "normal",
  "authority_assurance": "unavailable",
  "artifact_path": "docs/superpowers/specs/2026-09-12-1219-tiered-test-execution-design.md",
  "artifact_commit": "3006d3ac3b82c2b984142ee6005e0d489f8e5b09",
  "artifact_blob": "6c99f9b434bf7108900a645ca9278f82bd8b9010",
  "artifact_digest": "sha256:ced02d17da29f8530520b6dd2f308736f6e96bba23813aae791dbe1ece557cd9",
  "agent": {
    "host": "claude-code",
    "provider": "anthropic",
    "model_id": "claude-opus-5",
    "model_display": "Claude Opus 5",
    "session_fingerprint": "sha256:b442aba55add2575a307df23836f008c2fd2f4224f4758748bf984fd912fefe5",
    "identity_source": "runtime"
  },
  "started_at": "2026-09-12T17:17:14.905Z",
  "submitted_at": null,
  "finding_ids": [],
  "answered_finding_ids": [],
  "acknowledged_supplement_ids": []
}
