{
  "schema": "ai-peer-review.response/v1",
  "review_id": "review-bf339e74f46697b4da5d2d19cb3c822e",
  "role": "reviewer",
  "turn": 1,
  "commit_mode": "normal",
  "authority_assurance": "unavailable",
  "artifact_path": "docs/superpowers/specs/2026-09-20-aitm-mcp-adapter-architecture-design.md",
  "artifact_commit": "93a2c790be8c771324ae51eaf35b41bf029dd6ea",
  "artifact_blob": "a076d41e917efa17d7a23de75d139f1d898cef43",
  "artifact_digest": "sha256:7066ff40fdfffa399d279f453b3e4ee7dd0e26f96effcc2dff0475b76c2cf783",
  "agent": {
    "host": "claude-code",
    "provider": "anthropic",
    "model_id": "claude-opus-5",
    "model_display": "Claude Opus 5",
    "session_fingerprint": "sha256:7269798814f6e42c7dbd35031039451c136e87664d5bf2159f1e59823321f699",
    "identity_source": "declared"
  },
  "started_at": "2026-09-20T21:48:53.667Z",
  "submitted_at": null,
  "finding_ids": [],
  "answered_finding_ids": [],
  "acknowledged_supplement_ids": []
}
